{
  "artifactId": "RA-UI-TEST-REPAIR-20260830",
  "version": "v0.7",
  "artifactType": "requirement-anchor",
  "owner": "codex-control-plane",
  "sourceAnchorId": "RA-UI-TEST-REPAIR-20260830",
  "sourceAnchorVersion": "v0.7",
  "mappedFrAc": [
    "FR-001",
    "FR-002",
    "FR-003",
    "FR-004",
    "FR-005",
    "FR-006",
    "FR-007",
    "FR-008",
    "FR-009",
    "FR-010",
    "FR-011",
    "FR-012",
    "FR-013",
    "FR-014",
    "AC-001",
    "AC-002",
    "AC-003",
    "AC-004",
    "AC-005",
    "AC-006",
    "AC-007",
    "AC-008",
    "AC-009",
    "AC-010",
    "AC-011",
    "AC-012",
    "AC-013",
    "AC-014",
    "AC-015",
    "AC-016",
    "AC-017",
    "AC-018",
    "BR-001",
    "BR-002",
    "BR-003",
    "BR-004",
    "BR-005",
    "NFR-001",
    "NFR-002",
    "NFR-003",
    "NFR-004",
    "NFR-005",
    "NFR-006",
    "NFR-007",
    "NFR-008"
  ],
  "createdAt": "2026-09-03",
  "derivedFrom": [
    "RA-UI-TEST-REPAIR-20260830@v0.6"
  ],
  "supersedes": [
    "RA-UI-TEST-REPAIR-20260830@v0.6"
  ],
  "contentHash": "sha256:fa0ef8797017088dd535eee58810b502b84ff05dcf97a32152f66e4f54ca2b98",
  "evidenceRefs": [
    "review/final-landed-review.json",
    "evidence/as-tested-summary.json"
  ]
}
