{
  "artifactId": "ARCH-UI-TEST-REPAIR-20260903",
  "version": "v0.4",
  "artifactType": "architecture",
  "owner": "development-system/architecture",
  "sourceAnchorId": "RA-UI-TEST-REPAIR-20260830",
  "sourceAnchorVersion": "v0.7",
  "mappedFrAc": [
    "FR-001",
    "FR-002",
    "FR-003",
    "FR-004",
    "FR-005",
    "FR-006",
    "FR-007",
    "FR-008",
    "FR-009",
    "FR-010",
    "FR-011",
    "FR-012",
    "FR-013",
    "FR-014",
    "AC-001",
    "AC-002",
    "AC-003",
    "AC-004",
    "AC-005",
    "AC-006",
    "AC-007",
    "AC-008",
    "AC-009",
    "AC-010",
    "AC-011",
    "AC-012",
    "AC-013",
    "AC-014",
    "AC-015",
    "AC-016",
    "AC-017",
    "AC-018",
    "BR-001",
    "BR-002",
    "BR-003",
    "BR-004",
    "BR-005",
    "NFR-001",
    "NFR-002",
    "NFR-003",
    "NFR-004",
    "NFR-005",
    "NFR-006",
    "NFR-007",
    "NFR-008"
  ],
  "createdAt": "2026-09-03",
  "derivedFrom": [
    "ARCH-UI-TEST-REPAIR-20260903@v0.3"
  ],
  "contentHash": "sha256:5d20b238f0a25756bea3724dcdbe20ed9a08ddd42dc73622a4148acbffcb5dee",
  "evidenceRefs": [
    "global-skill-install-result-20260902.json",
    "formal-list-route-fallback-deploy-result-20260903.json",
    "formal-list-route-fallback-verification-20260903.json",
    "formal-cache-cleanup-result-20260903.json",
    "RVI-20260903-R2-A-FORMAL-011",
    "RVI-20260903-R2-B-FORMAL-001"
  ],
  "supersedes": [
    "ARCH-UI-TEST-REPAIR-20260903@v0.3"
  ]
}
